{"schema_version":"task-status.v1","protocol":"worldeval-conversation/0.1.0","status_id":"status-1","task_id":"task-1","revision":0,"source":{"observation_seq":4,"tick":12,"state_hash":"sha256:1111111111111111111111111111111111111111111111111111111111111111"},"state":"ready","active_plan_id":null,"summary":"The blue box is uniquely grounded and ready for planning.","visibility":"public"}
